{
  "manifestVersion": 1,

  "id": "my-diagram-tool",
  "name": "My Diagram Tool",
  "description": "One or two sentences: what fence languages this renders, and what it downloads (size, runtime). Users decide from this text.",
  "version": "0.1.0",
  "homepage": "https://example.com/my-diagram-tool",
  "license": "MIT",

  "type": "diagram",
  "fenceLanguages": ["mytool"],

  "artifacts": [
    {
      "name": "mytool-windows.zip",
      "os": "windows",
      "arch": "x64",
      "source": "url",
      "url": "https://example.com/releases/mytool-1.0.0-windows-x64.zip",
      "sha256": "0000000000000000000000000000000000000000000000000000000000000000",
      "extract": true,
      "stripRoot": true
    },
    {
      "name": "mytool-linux.tar.gz",
      "os": "linux",
      "arch": "x64",
      "source": "url",
      "url": "https://example.com/releases/mytool-1.0.0-linux-x64.tar.gz",
      "sha256": "0000000000000000000000000000000000000000000000000000000000000000",
      "extract": true,
      "stripRoot": true
    },
    {
      "name": "mytool-mac.tar.gz",
      "os": "mac",
      "source": "url",
      "url": "https://example.com/releases/mytool-1.0.0-macos-universal.tar.gz",
      "sha256": "0000000000000000000000000000000000000000000000000000000000000000",
      "extract": true,
      "stripRoot": true
    }
  ],

  "render": {
    "command": "{dir}/mytool",
    "args": ["render", "--format", "svg", "{input}", "{output}"],
    "input": "file",
    "output": "file",
    "timeoutSeconds": 20
  }
}
