{
  "manifestVersion": 1,
  "id": "typst",
  "name": "Typst Snippets",
  "description": "Renders ```typst code blocks — beautifully typeset math, tables, and figures without a LaTeX install. Downloads the official single-binary Typst release (~20 MB) on install.",
  "version": "1.1.0",
  "homepage": "https://typst.app",
  "license": "Apache-2.0",
  "type": "diagram",
  "fenceLanguages": ["typst"],
  "artifacts": [
    {
      "name": "typst.zip",
      "os": "windows",
      "arch": "x64",
      "source": "github-latest",
      "repo": "typst/typst",
      "assetPattern": "^typst-x86_64-pc-windows-msvc\\.zip$",
      "extract": true,
      "stripRoot": true
    },
    {
      "name": "typst.zip",
      "os": "windows",
      "arch": "aarch64",
      "source": "github-latest",
      "repo": "typst/typst",
      "assetPattern": "^typst-aarch64-pc-windows-msvc\\.zip$",
      "extract": true,
      "stripRoot": true
    },
    {
      "name": "typst.tar.xz",
      "os": "linux",
      "arch": "x64",
      "source": "github-latest",
      "repo": "typst/typst",
      "assetPattern": "^typst-x86_64-unknown-linux-musl\\.tar\\.xz$",
      "extract": true,
      "stripRoot": true
    },
    {
      "name": "typst.tar.xz",
      "os": "linux",
      "arch": "aarch64",
      "source": "github-latest",
      "repo": "typst/typst",
      "assetPattern": "^typst-aarch64-unknown-linux-musl\\.tar\\.xz$",
      "extract": true,
      "stripRoot": true
    },
    {
      "name": "typst.tar.xz",
      "os": "mac",
      "arch": "aarch64",
      "source": "github-latest",
      "repo": "typst/typst",
      "assetPattern": "^typst-aarch64-apple-darwin\\.tar\\.xz$",
      "extract": true,
      "stripRoot": true
    },
    {
      "name": "typst.tar.xz",
      "os": "mac",
      "arch": "x64",
      "source": "github-latest",
      "repo": "typst/typst",
      "assetPattern": "^typst-x86_64-apple-darwin\\.tar\\.xz$",
      "extract": true,
      "stripRoot": true
    }
  ],
  "render": {
    "command": "{dir}/typst",
    "args": ["compile", "--format", "svg", "{input}", "{output}"],
    "input": "file",
    "inputExtension": ".typ",
    "output": "file",
    "timeoutSeconds": 30
  }
}
